{"$id":"https://github.com/martin-beck/agent-workflow-quality/schemas/workflow-claims.schema.json","$schema":"https://json-schema.org/draft/2020-12/schema","additionalProperties":false,"properties":{"claims":{"items":{"additionalProperties":false,"properties":{"authority":{"minLength":1,"type":"string"},"evidence":{"items":{"additionalProperties":false,"properties":{"digest":{"pattern":"^[0-9a-f]{64}$","type":"string"},"id":{"pattern":"^EVIDENCE-[A-Z0-9]+(?:-[A-Z0-9]+)*$","type":"string"},"maturity":{"enum":["planned","contract-tested","environment-verified","human-reviewed"]},"source":{"minLength":1,"type":"string"}},"required":["id","maturity","digest","source"],"type":"object"},"maxItems":32,"minItems":1,"type":"array"},"id":{"pattern":"^AWQ-WF-[A-Z0-9]+(?:-[A-Z0-9]+)*$","type":"string"},"limitations":{"items":{"minLength":10,"type":"string"},"minItems":1,"type":"array"},"maturity":{"enum":["planned","contract-tested","environment-verified","human-reviewed"]},"semantic_tests":{"items":{"minLength":1,"type":"string"},"minItems":1,"type":"array","uniqueItems":true},"stage":{"enum":["goal","preconditions","automatic-actions","human-decisions","outcomes","failures","recovery"]},"statement":{"maxLength":300,"minLength":1,"type":"string"},"visual_asset_ids":{"items":{"pattern":"^ASSET-[A-Z0-9]+(?:-[A-Z0-9]+)*$","type":"string"},"maxItems":128,"type":"array","uniqueItems":true}},"required":["id","stage","maturity","statement","authority","semantic_tests","evidence","limitations","visual_asset_ids"],"type":"object"},"maxItems":128,"minItems":1,"type":"array"},"schema_version":{"const":1},"sources":{"items":{"additionalProperties":false,"properties":{"claim_ids":{"items":{"pattern":"^AWQ-WF-[A-Z0-9]+(?:-[A-Z0-9]+)*$","type":"string"},"maxItems":128,"type":"array","uniqueItems":true},"commit":{"pattern":"^[0-9a-f]{40}$","type":"string"},"derived_from":{"type":["string","null"]},"generator_sha256":{"oneOf":[{"pattern":"^[0-9a-f]{64}$","type":"string"},{"type":"null"}]},"kind":{"enum":["authored","generated","derived","superseded"]},"path":{"minLength":1,"type":"string"},"sha256":{"pattern":"^[0-9a-f]{64}$","type":"string"}},"required":["path","commit","sha256","kind","claim_ids","derived_from","generator_sha256"],"type":"object"},"maxItems":128,"minItems":1,"type":"array"},"visual_assets":{"items":{"additionalProperties":false,"properties":{"accessibility":{"minLength":10,"type":"string"},"baseline":{"oneOf":[{"additionalProperties":false,"properties":{"comparison":{"const":"sha256-equality"},"matches":{"type":"boolean"},"sha256":{"pattern":"^[0-9a-f]{64}$","type":"string"}},"required":["sha256","comparison","matches"],"type":"object"},{"type":"null"}]},"capture":{"additionalProperties":false,"properties":{"captured_at":{"format":"date-time","type":"string"},"current_source_revision":{"pattern":"^[0-9a-f]{40}$","type":"string"},"environment_class":{"enum":["consumer-controlled","reviewed-lab"]},"reviewed_at":{"format":"date-time","type":"string"},"source_revision":{"pattern":"^[0-9a-f]{40}$","type":"string"}},"required":["source_revision","current_source_revision","environment_class","captured_at","reviewed_at"],"type":"object"},"claim_id":{"pattern":"^AWQ-WF-[A-Z0-9]+(?:-[A-Z0-9]+)*$","type":"string"},"consumer_dimensions":{"additionalProperties":false,"properties":{"abi":{"minLength":1,"type":"string"},"api":{"minLength":1,"type":"string"},"font_scale":{"minLength":1,"type":"string"},"form_factor":{"minLength":1,"type":"string"},"locale":{"minLength":1,"type":"string"}},"required":["api","abi","form_factor","locale","font_scale"],"type":"object"},"format":{"enum":["png","jpeg","webp","svg"]},"height":{"maximum":10000,"minimum":1,"type":"integer"},"id":{"pattern":"^ASSET-[A-Z0-9]+(?:-[A-Z0-9]+)*$","type":"string"},"path":{"minLength":1,"type":"string"},"reviewed":{"const":true},"sha256":{"pattern":"^[0-9a-f]{64}$","type":"string"},"source":{"minLength":1,"type":"string"},"width":{"maximum":10000,"minimum":1,"type":"integer"}},"required":["id","path","sha256","width","height","format","accessibility","source","reviewed","claim_id","capture","consumer_dimensions","baseline"],"type":"object"},"maxItems":128,"type":"array"}},"required":["schema_version","claims","sources","visual_assets"],"type":"object"}
