{"claims":[{"authority":"docs/WORKFLOW_CLAIMS.md","evidence":[{"digest":"aaaaaaaaaaaaaaaaaaaaaaaaaaaaaaaaaaaaaaaaaaaaaaaaaaaaaaaaaaaaaaaa","id":"EVIDENCE-GOAL","maturity":"contract-tested","source":"docs/WORKFLOW_CLAIMS.md"}],"id":"AWQ-WF-GOAL","limitations":["This claim describes a bounded contract, not observed usability."],"maturity":"contract-tested","semantic_tests":["tests/test_workflow_claims.py::test_valid"],"stage":"goal","statement":"The workflow declares its bounded user-visible goal.","visual_asset_ids":[]},{"authority":"docs/WORKFLOW_CLAIMS.md","evidence":[{"digest":"aaaaaaaaaaaaaaaaaaaaaaaaaaaaaaaaaaaaaaaaaaaaaaaaaaaaaaaaaaaaaaaa","id":"EVIDENCE-PRECONDITIONS","maturity":"contract-tested","source":"docs/WORKFLOW_CLAIMS.md"}],"id":"AWQ-WF-PRECONDITIONS","limitations":["Consumer environments remain independently controlled."],"maturity":"contract-tested","semantic_tests":["tests/test_workflow_claims.py::test_valid"],"stage":"preconditions","statement":"The workflow declares its required preconditions.","visual_asset_ids":[]},{"authority":"docs/WORKFLOW_CLAIMS.md","evidence":[{"digest":"aaaaaaaaaaaaaaaaaaaaaaaaaaaaaaaaaaaaaaaaaaaaaaaaaaaaaaaaaaaaaaaa","id":"EVIDENCE-ACTIONS","maturity":"contract-tested","source":"docs/WORKFLOW_CLAIMS.md"}],"id":"AWQ-WF-AUTOMATIC-ACTIONS","limitations":["No external action is performed by registry validation."],"maturity":"contract-tested","semantic_tests":["tests/test_workflow_claims.py::test_valid"],"stage":"automatic-actions","statement":"Automatic actions are distinguished from human decisions.","visual_asset_ids":[]},{"authority":"docs/WORKFLOW_CLAIMS.md","evidence":[{"digest":"aaaaaaaaaaaaaaaaaaaaaaaaaaaaaaaaaaaaaaaaaaaaaaaaaaaaaaaaaaaaaaaa","id":"EVIDENCE-DECISIONS","maturity":"contract-tested","source":"docs/WORKFLOW_CLAIMS.md"}],"id":"AWQ-WF-HUMAN-DECISIONS","limitations":["Human approval remains external to deterministic validation."],"maturity":"contract-tested","semantic_tests":["tests/test_workflow_claims.py::test_valid"],"stage":"human-decisions","statement":"Human decisions are explicit and cannot be inferred from artifacts.","visual_asset_ids":[]},{"authority":"docs/WORKFLOW_CLAIMS.md","evidence":[{"digest":"aaaaaaaaaaaaaaaaaaaaaaaaaaaaaaaaaaaaaaaaaaaaaaaaaaaaaaaaaaaaaaaa","id":"EVIDENCE-OUTCOMES","maturity":"human-reviewed","source":"docs/WORKFLOW_CLAIMS.md"}],"id":"AWQ-WF-OUTCOMES","limitations":["Pixel equality is not a usability or visual approval claim."],"maturity":"human-reviewed","semantic_tests":["tests/test_workflow_claims.py::test_valid","tests/test_workflow_claims.py::test_visual_evidence_is_revision_bound_and_deterministic"],"stage":"outcomes","statement":"The workflow exposes bounded, reviewable outcomes.","visual_asset_ids":["ASSET-WORKFLOW"]},{"authority":"docs/WORKFLOW_CLAIMS.md","evidence":[{"digest":"aaaaaaaaaaaaaaaaaaaaaaaaaaaaaaaaaaaaaaaaaaaaaaaaaaaaaaaaaaaaaaaa","id":"EVIDENCE-FAILURES","maturity":"contract-tested","source":"docs/WORKFLOW_CLAIMS.md"}],"id":"AWQ-WF-FAILURES","limitations":["The registry does not execute consumer failure scenarios."],"maturity":"contract-tested","semantic_tests":["tests/test_workflow_claims.py::test_hostile_claims_and_assets_fail_closed"],"stage":"failures","statement":"Expected failure behavior remains explicit and fail closed.","visual_asset_ids":[]},{"authority":"docs/WORKFLOW_CLAIMS.md","evidence":[{"digest":"aaaaaaaaaaaaaaaaaaaaaaaaaaaaaaaaaaaaaaaaaaaaaaaaaaaaaaaaaaaaaaaa","id":"EVIDENCE-RECOVERY","maturity":"contract-tested","source":"docs/WORKFLOW_CLAIMS.md"}],"id":"AWQ-WF-RECOVERY","limitations":["Recovery effectiveness remains consumer-owned evidence."],"maturity":"contract-tested","semantic_tests":["tests/test_workflow_claims.py::test_valid"],"stage":"recovery","statement":"Recovery steps and their limitations are review visible.","visual_asset_ids":[]}],"schema_version":1,"sources":[{"claim_ids":["AWQ-WF-GOAL","AWQ-WF-PRECONDITIONS","AWQ-WF-AUTOMATIC-ACTIONS","AWQ-WF-HUMAN-DECISIONS","AWQ-WF-OUTCOMES","AWQ-WF-FAILURES","AWQ-WF-RECOVERY"],"commit":"0000000000000000000000000000000000000000","derived_from":null,"generator_sha256":null,"kind":"authored","path":"docs/WORKFLOW_CLAIMS.md","sha256":"bbbbbbbbbbbbbbbbbbbbbbbbbbbbbbbbbbbbbbbbbbbbbbbbbbbbbbbbbbbbbbbb"},{"claim_ids":["AWQ-WF-OUTCOMES"],"commit":"0000000000000000000000000000000000000000","derived_from":"docs/WORKFLOW_CLAIMS.md","generator_sha256":"cccccccccccccccccccccccccccccccccccccccccccccccccccccccccccccccc","kind":"generated","path":"docs/generated/workflow-claims.md","sha256":"dddddddddddddddddddddddddddddddddddddddddddddddddddddddddddddddd"},{"claim_ids":["AWQ-WF-OUTCOMES"],"commit":"0000000000000000000000000000000000000000","derived_from":"docs/WORKFLOW_CLAIMS.md","generator_sha256":null,"kind":"derived","path":"docs/workflow-summary.md","sha256":"eeeeeeeeeeeeeeeeeeeeeeeeeeeeeeeeeeeeeeeeeeeeeeeeeeeeeeeeeeeeeeee"},{"claim_ids":[],"commit":"0000000000000000000000000000000000000000","derived_from":"docs/WORKFLOW_CLAIMS.md","generator_sha256":null,"kind":"superseded","path":"docs/old-workflow.md","sha256":"ffffffffffffffffffffffffffffffffffffffffffffffffffffffffffffffff"}],"visual_assets":[{"accessibility":"A schematic showing the bounded workflow outcome and recovery path.","baseline":{"comparison":"sha256-equality","matches":true,"sha256":"1111111111111111111111111111111111111111111111111111111111111111"},"capture":{"captured_at":"2026-09-01T00:00:00Z","current_source_revision":"0000000000000000000000000000000000000000","environment_class":"consumer-controlled","reviewed_at":"2026-09-02T00:00:00Z","source_revision":"0000000000000000000000000000000000000000"},"claim_id":"AWQ-WF-OUTCOMES","consumer_dimensions":{"abi":"consumer-declared","api":"consumer-declared","font_scale":"consumer-declared","form_factor":"consumer-declared","locale":"consumer-declared"},"format":"png","height":720,"id":"ASSET-WORKFLOW","path":"docs/assets/workflow.png","reviewed":true,"sha256":"1111111111111111111111111111111111111111111111111111111111111111","source":"docs/WORKFLOW_CLAIMS.md","width":1280}]}
